[
  {
    "id": "gpu-cloud",
    "name_zh": "GPU 算力租赁",
    "name_en": "GPU Cloud",
    "domain": "infrastructure",
    "maturity": "established",
    "summary_zh": "面向训练与推理的 GPU 集群租赁与调度服务。",
    "summary_en": "Rental and orchestration of GPU clusters for AI training and inference.",
    "why_new_zh": "AI 训练/推理对算力需求爆发，催生独立于传统云的算力新云品类。",
    "why_new_en": "Exploding compute demand for AI training and inference created a 'neocloud' category independent of traditional cloud providers.",
    "skills": ["大规模集群运维", "网络/存储优化", "调度与计费"],
    "examples": ["GPU 云厂商", "Neocloud 新云"],
    "event_ids": [],
    "sources": []
  },
  {
    "id": "ai-inference-infra",
    "name_zh": "AI 推理基础设施",
    "name_en": "Inference Infrastructure",
    "domain": "infrastructure",
    "maturity": "growing",
    "summary_zh": "优化大模型推理的延迟、吞吐与成本的中间层（服务、编译、量化）。",
    "summary_en": "The middle layer that optimizes LLM inference latency, throughput, and cost — serving, compilation, quantization.",
    "why_new_zh": "模型部署成本高，推理优化成为独立且高价值的工具与服务品类。",
    "why_new_en": "High deployment costs turned inference optimization into a standalone, high-value tools and services category.",
    "skills": ["推理优化", "量化/蒸馏", "GPU 内核", "服务化"],
    "examples": ["推理 SaaS", "模型托管平台"],
    "event_ids": [],
    "sources": []
  },
  {
    "id": "vector-database",
    "name_zh": "向量数据库",
    "name_en": "Vector Database",
    "domain": "infrastructure",
    "maturity": "growing",
    "summary_zh": "存储与检索向量嵌入，为 RAG 等检索增强应用提供基础设施。",
    "summary_en": "Stores and retrieves vector embeddings, powering RAG and other retrieval-augmented applications.",
    "why_new_zh": "RAG 与语义检索普及，使向量存储从功能变为独立基础设施品类。",
    "why_new_en": "The spread of RAG and semantic search turned vector storage from a feature into its own infrastructure category.",
    "skills": ["向量检索算法 (ANN)", "分布式存储", "嵌入模型理解"],
    "examples": ["向量数据库厂商", "传统数据库厂商扩展"],
    "event_ids": [],
    "sources": []
  },
  {
    "id": "synthetic-data",
    "name_zh": "合成数据",
    "name_en": "Synthetic Data",
    "domain": "data",
    "maturity": "growing",
    "summary_zh": "生成人工数据用于训练/微调，缓解真实数据稀缺与隐私限制。",
    "summary_en": "Generates artificial data for training and fine-tuning, easing real-data scarcity and privacy constraints.",
    "why_new_zh": "高质量训练数据接近枯竭，合成数据成为新的数据供给品类。",
    "why_new_en": "With high-quality training data running out, synthetic data became a new supply category of its own.",
    "skills": ["数据生成", "质量过滤", "隐私保护"],
    "examples": ["合成数据平台", "模型实验室数据管线"],
    "event_ids": [],
    "sources": []
  },
  {
    "id": "ai-agent-platform",
    "name_zh": "AI Agent 平台",
    "name_en": "Agent Infrastructure",
    "domain": "product",
    "maturity": "emerging",
    "summary_zh": "构建、编排、监控自主 AI Agent 的框架与运行时（工具调用、记忆、评估）。",
    "summary_en": "Frameworks and runtimes for building, orchestrating, and monitoring autonomous AI agents — tool use, memory, evaluation.",
    "why_new_zh": "Agent 从单次问答转向多步自主执行，需要全新的编排与观测基础设施。",
    "why_new_en": "As agents moved from single-turn Q&A to multi-step autonomy, an entirely new orchestration and observability stack became necessary.",
    "skills": ["编排设计", "工具/函数调用", "可观测性", "评估"],
    "examples": ["Agent 框架", "Agent 运行时平台"],
    "event_ids": [],
    "sources": []
  },
  {
    "id": "ai-content-detection",
    "name_zh": "AI 内容检测与溯源",
    "name_en": "Content Detection & Provenance",
    "domain": "safety",
    "maturity": "emerging",
    "summary_zh": "检测 AI 生成内容、添加水印与溯源，服务教育、媒体与合规场景。",
    "summary_en": "Detects AI-generated content and adds watermarking and provenance, serving education, media, and compliance.",
    "why_new_zh": "生成内容泛滥带来真实性与版权问题，催生检测与溯源工具市场。",
    "why_new_en": "The flood of generated content raised authenticity and copyright problems, spawning a detection and provenance tooling market.",
    "skills": ["检测模型", "水印技术", "内容溯源标准"],
    "examples": ["内容检测 SaaS", "数字水印方案"],
    "event_ids": [],
    "sources": []
  }
]
